{
  "schema": "gabagool.template.v1",
  "template_id": "bank_block",
  "label": "Bank Block",
  "description": "The big score: a bank on a block with a service lane behind it, a lobby and teller line, a vault of money racks and a deposit vault lined with boxes. In through the front, down to the vault, back to the van.",
  "batch": {
    "seed_base": 9003,
    "theme_family": "delco"
  },
  "brief": {
    "schema": "level_factory.mission_brief.v0.1",
    "archetype": "urban_bank",
    "building_count": 3,
    "site_shape": "street_block",
    "road_grammar": "block",
    "route_shape": "push_then_backtrack",
    "objective_hypotheses": [
      "enter_bank",
      "reach_vault",
      "hold_vault",
      "carry_loot",
      "return_to_vehicle"
    ],
    "extraction_relationship": "crew_start_backtrack",
    "verticality": "medium",
    "landmark": "bank_clock",
    "time_of_day": "afternoon",
    "weather": "clear",
    "theme": "delco_1997",
    "candidate_count": 3,
    "target_minutes": [
      25,
      35
    ]
  }
}
